{"schema_version":1,"issued_unix":1704067200,"expires_unix":1706745600,"releases":[{"release":"v0.0.1","target":"x86_64-unknown-linux-gnu","asb_version":"0.1.0","protocol_version":1,"manifest_url":"https://github.com/martin-beck/asb-tui/releases/download/v0.0.1/manifest.json","manifest_signature_url":"https://github.com/martin-beck/asb-tui/releases/download/v0.0.1/manifest.json.sig","manifest_sha256":"3963878e6f2de9837a42ee3c157eceee80526949036462afeba4e71aff1f8b09"}]}
